link,tags,likes,comments
https://cdn.pixabay.com/photo/2022/03/06/05/30/clouds-7050884__480.jpg,"Sky Sky, Clouds, Atmosphere, Blue",196,55
https://cdn.pixabay.com/photo/2022/04/07/11/45/bird-7117346__340.jpg,"Bird, Hummingbird Ornithology,",76,20
https://cdn.pixabay.com/photo/2022/02/28/15/28/sea-7039471__340.jpg,"Subtropical Rainfall, Sea, Rainbow,",282,106
https://cdn.pixabay.com/photo/2022/04/04/02/52/cherry-blossoms-7110279__340.jpg,"Blossoms, Road, Japan, Sakura Cherry",42,11
https://cdn.pixabay.com/photo/2022/04/09/18/06/cape-marguerite-7121992__340.jpg,"Marguerite, Plant Flower, Cape",39,15
https://cdn.pixabay.com/photo/2021/11/13/23/06/tree-6792528__340.jpg,Tree Under Rest The Relaxing,522,108
https://cdn.pixabay.com/photo/2022/04/07/02/56/cottontail-rabbit-7116707__340.jpg,"Cottontail Rabbit, Grass Wild",51,10
https://cdn.pixabay.com/photo/2022/03/19/21/11/crocus-7079550__340.jpg,"Plant Crocus, Flowers, Spring,",135,44
https://cdn.pixabay.com/photo/2022/04/09/17/30/coffee-7121939__340.jpg,"Coffee, Café, Vacation, Drink, Table",26,5
https://cdn.pixabay.com/photo/2022/03/25/19/24/waterfall-7091641__340.jpg,"Nature, Light Fall, Waterfall, Epic,",96,21
https://cdn.pixabay.com/photo/2021/08/25/20/42/field-6574455__340.jpg,"Nature Morning, Dawn, Field, Sunrise,",807,131
https://cdn.pixabay.com/photo/2022/04/04/18/03/bird-7111988__340.jpg,"Bird, Robin, Animal Birdwatching,",69,19
https://cdn.pixabay.com/photo/2022/04/04/07/58/seedlings-7110591__340.jpg,"Spring Seedlings, Flowers, Soil, Bloom",42,9
https://cdn.pixabay.com/photo/2022/03/23/21/27/road-7087957__340.jpg,"Countryside, Hills Road, Highway,",53,14
https://cdn.pixabay.com/photo/2022/03/27/15/03/cityscape-7095358__340.jpg,"Monochrome, City Cityscape, Bridge,",45,13
https://cdn.pixabay.com/photo/2022/03/25/17/54/sakura-7091532__340.jpg,"Water Blossoms, Spring, Cherry Sakura,",70,12
https://cdn.pixabay.com/photo/2022/04/01/19/03/background-7105471__480.jpg,"Art Background, Easter, Template, Eggs,",5,2
https://cdn.pixabay.com/photo/2022/01/31/12/46/bird-6983434__340.jpg,"Bird, Chat, Ornithology, Species Indian",171,53
https://cdn.pixabay.com/photo/2022/01/18/16/49/town-6947538__340.jpg,"Winter, Town, Night, Season Village,",109,15
https://cdn.pixabay.com/photo/2022/04/09/17/42/flower-7121955__340.jpg,"Pansy, Viola, Blossom, Flower, Bloom",55,36
https://cdn.pixabay.com/photo/2021/08/30/21/29/port-6587129__340.jpg,"Port, Architecture, Vacations Lake,",276,49
https://cdn.pixabay.com/photo/2022/03/16/02/03/sunflowers-7071449__340.jpg,"Sunflowers, Plant Flowers,",54,21
https://cdn.pixabay.com/photo/2022/03/28/18/41/coffee-7098126__340.jpg,"Morning Coffee, Flowers, Spring,",40,10
https://cdn.pixabay.com/photo/2022/02/12/06/21/roys-peak-7008528__340.jpg,"Lake, Wanaka, Roys Peak, Mountains",69,19
https://cdn.pixabay.com/photo/2021/11/21/21/14/mountain-6815304__340.jpg,"downloads you, for Thank everyone. you and likes. many",197,0
https://cdn.pixabay.com/photo/2021/08/22/15/48/nature-6565499__340.jpg,"Nature, Exploration Beach, Outdoors,",272,150
https://cdn.pixabay.com/photo/2022/03/03/11/18/nature-7045125__340.jpg,Shot Jutland. of The Danish during West sunset. Coast,48,11
https://cdn.pixabay.com/photo/2022/03/16/21/01/gentoo-penguin-7073391__340.jpg,"Bird, Gentoo Animal Penguin,",93,22
https://cdn.pixabay.com/photo/2021/11/26/20/45/lantern-6826698__340.jpg,"Lantern, Tree Heaven, Water, Beach, Sea,",243,31
https://cdn.pixabay.com/photo/2022/04/03/05/03/easter-7108066__340.jpg,"Easter, Easter Bunny Spring,",17,10
https://cdn.pixabay.com/photo/2018/01/14/23/12/nature-3082832__340.jpg,rock green formation on brown during lake daytime trees,3098,495
https://cdn.pixabay.com/photo/2022/02/27/19/46/tourist-attraction-7037967__340.jpg,"Tourist Travel Attraction, Tower, Eiffel",83,21
https://cdn.pixabay.com/photo/2022/04/07/22/23/menhir-7118382__480.jpg,"Stones, Menhir, Clouds, Stones Standing",64,49
https://cdn.pixabay.com/photo/2022/01/13/18/05/road-6935773__340.jpg,"Winter, Path Snow, Frost, Road, Trees,",133,24
https://cdn.pixabay.com/photo/2022/04/10/07/03/bird-7122753__340.jpg,"Bird, Woodpecker",28,20
https://cdn.pixabay.com/photo/2021/11/25/19/50/tape-6824489__340.jpg,"Classic Tape, Music, Retro, Cassette,",134,20
https://cdn.pixabay.com/photo/2022/01/10/15/29/wind-mills-6928590__340.jpg,"Mills, Wind Clouds, Energy, Power",144,101
https://cdn.pixabay.com/photo/2022/02/15/07/27/travel-7014427__340.jpg,"Travel, Tartini, Square, Piran Tourism,",70,19
https://cdn.pixabay.com/photo/2022/04/11/04/33/easter-eggs-7124718__340.jpg,"Colored Nest, Eggs Easter Eggs,",29,0
https://cdn.pixabay.com/photo/2022/02/07/22/27/winter-7000429__340.jpg,"Season, Winter, Travel Nature, Outdoors,",111,24
https://cdn.pixabay.com/photo/2022/04/11/09/40/glacier-7125386__340.jpg,"Glacier, Glacier Melting Dying Glaciers,",36,27
https://cdn.pixabay.com/photo/2021/11/01/21/31/forest-6761846__340.jpg,"Jungle, Nature Green, Forest, Tropical,",135,22
https://cdn.pixabay.com/photo/2022/02/05/08/13/tulip-6994245__340.jpg,"Blossom, Bloom, Petals Tulip, Flower,",92,35
https://cdn.pixabay.com/photo/2022/04/07/13/06/flowers-7117461__340.jpg,"Petals Pink Flowers,",62,0
https://cdn.pixabay.com/photo/2022/02/22/03/22/passiflora-7027917__340.jpg,"Passion Passiflora, Flower Flower,",97,66
https://cdn.pixabay.com/photo/2021/11/02/21/57/prayer-6764197__340.jpg,"Prayer, Faith, Blessing Hope, Religion,",175,57
https://cdn.pixabay.com/photo/2022/04/09/10/13/galaxy-7121195__340.jpg,"Star, Space, Universe, Galaxy, Cosmos",45,40
https://cdn.pixabay.com/photo/2022/03/31/09/25/dragonfly-7102558__480.jpg,"Dragonfly, Nature, Insect, Macro",19,3
